[
  {
    "trip_id": "trip-0001",
    "employee_alias": "employee-001",
    "department": "Sales",
    "cost_center": "cc-1001",
    "origin_city": "Tokyo",
    "destination_city": "Osaka",
    "country": "Japan",
    "start_date": "2026-05-11",
    "end_date": "2026-05-12",
    "purpose": "顧客訪問",
    "cabin_class_requested": "economy",
    "preapproval_status": "simulated_not_required"
  },
  {
    "trip_id": "trip-0002",
    "employee_alias": "employee-002",
    "department": "Engineering",
    "cost_center": "cc-2001",
    "origin_city": "Tokyo",
    "destination_city": "Fukuoka",
    "country": "Japan",
    "start_date": "2026-06-01",
    "end_date": "2026-06-03",
    "purpose": "社内カンファレンス登壇",
    "cabin_class_requested": "economy",
    "preapproval_status": "simulated_not_required"
  },
  {
    "trip_id": "trip-0003",
    "employee_alias": "employee-003",
    "department": "Marketing",
    "cost_center": "cc-3001",
    "origin_city": "Tokyo",
    "destination_city": "New York",
    "country": "United States",
    "start_date": "2026-07-10",
    "end_date": "2026-07-15",
    "purpose": "展示会出展",
    "cabin_class_requested": "business",
    "preapproval_status": "simulated_pending_vp_review"
  },
  {
    "trip_id": "trip-0004",
    "employee_alias": "employee-004",
    "department": "Engineering",
    "cost_center": "cc-2002",
    "origin_city": "Tokyo",
    "destination_city": "Singapore",
    "country": "Singapore",
    "start_date": "2026-05-20",
    "end_date": "2026-05-22",
    "purpose": "技術検証ワークショップ",
    "cabin_class_requested": "premium_economy",
    "preapproval_status": "simulated_pending_manager_review"
  },
  {
    "trip_id": "trip-0005",
    "employee_alias": "employee-005",
    "department": "Human Resources",
    "cost_center": "cc-4001",
    "origin_city": "Osaka",
    "destination_city": "Sapporo",
    "country": "Japan",
    "start_date": "2026-08-03",
    "end_date": "2026-08-04",
    "purpose": "採用イベント",
    "cabin_class_requested": "economy",
    "preapproval_status": "simulated_not_required"
  },
  {
    "trip_id": "trip-0006",
    "employee_alias": "employee-006",
    "department": "Finance",
    "cost_center": "cc-5001",
    "origin_city": "Tokyo",
    "destination_city": "London",
    "country": "United Kingdom",
    "start_date": "2026-09-01",
    "end_date": "2026-09-06",
    "purpose": "監査対応",
    "cabin_class_requested": "business",
    "preapproval_status": "simulated_pending_vp_review"
  },
  {
    "trip_id": "trip-0007",
    "employee_alias": "employee-007",
    "department": "Sales",
    "cost_center": "cc-1002",
    "origin_city": "Tokyo",
    "destination_city": "Hong Kong",
    "country": "Hong Kong",
    "start_date": "2026-05-25",
    "end_date": "2026-05-27",
    "purpose": "商談",
    "cabin_class_requested": "economy",
    "preapproval_status": "simulated_pending_manager_review"
  },
  {
    "trip_id": "trip-0008",
    "employee_alias": "employee-008",
    "department": "Customer Support",
    "cost_center": "cc-6001",
    "origin_city": "Tokyo",
    "destination_city": "Nagoya",
    "country": "Japan",
    "start_date": "2026-06-15",
    "end_date": "2026-06-15",
    "purpose": "オンサイトサポート",
    "cabin_class_requested": "economy",
    "preapproval_status": "simulated_not_required"
  }
]
